Bug area,Sub-area,project(app/web?),Checkpoint,Related issues
Filter,Multiple filters,VHM,"注意同一个页面上筛选器之间的关联性
Focus on the relevance of filters on the same page.",VHM-253
Footer,,ThePlant website,"检查页面内所有的链接在pc端和移动端是否能正常工作
Check whether all links on the page work properly on PC and mobile devices.",https://theplant.slack.com/archives/C7FRMTSPN/p1745844396814689?thread_ts=1745461604.089839&cid=C7FRMTSPN
Form,Submit button,VHM,"多次点击提交按钮观察接口发送次数
Click the Submit button multiple times to observe the number of interfaces",VHM-779
Form,Button,VHM,"注意观察按钮光标效果
Observe the button cursor effect",VHM-783
Form,Inquiry Form,VHM,"注意检查在营业时间外内容展示是否正确
（VHM：营业时间外不展示电话）
Please check whether the content is displayed correctly outside business hours",VHM-744
Form,,VHM,"注意检查提交表单后的文字是否同步翻译
Please check whether the text is translated synchronously after submitting the form",VHM-1591
Form,,VHM,"检查取消上传照片后，功能是否正常
Check if the function is working properly after canceling the upload of the photos.",VHM-1693
MMR Gacha,,JMA,"在弹出弹窗时需要注意其他地方是否还能操作
When a pop-up window appears, it is necessary to pay attention to whether other areas can still be operated.",MMR-579
MMR Gacha,,JMA,"注意勾选不再显示之后，弹窗是否还会再出现
Pay attention to whether the pop-up window will reappear after checking ""Do not show again"".",SHFT-1084
Gallery,,VHM,"注意切换图片后是否影响附近UI(例如按钮缺失)
Pay attention to whether switching pictures affects nearby UI (such as missing buttons)",VHM-823
Home,Loading Page,JMA,"「新功能」检查版本更新后之前的改动是否还有遗留(特别是加载显示时)
「New function」Check if there are any remaining changes after the version update (especially when loading the display)",JMA-2731
Home,,JMA,"注意检查页面滑动是否流畅
Check whether the page slides smoothly",JMA-2569
Home,Navigation bar,Aigle,"检查所有浏览器的Navigation bar是否展示正常
Check if the Navigation bar is displayed properly in all browsers",LAC-2963
Home,search link,KAK,"检查在CMS中设置的跳转链接，在APP中是否跳转到正确位置，显示是否正常
Check the jump link set in the CMS to see if it jumps to the correct location in the APP and whether it is displayed normally.",KAK-5414
Home,Ongoing order,KAK,"注意成功取消订单后取消按钮需要隐藏
Note that the cancellation button needs to be hidden after a successful order cancellation",KAK-2737
Home,Banner,JMA,"注意在lucky bag阶段变化后，banner是否能及时变换
Pay attention to whether the banner can be changed in time after the lucky bag stage changes.",MDX-10634
Home,Error popup,KAK,"确保同一操作流程能稳定复现错误提示
Verify that the error prompt appears reliably when following the same sequence of operations.",KAK-6684
Home,banner,JMA,"检查home的新增banner跳转是否正常
Check whether the newly added banner jump of home page is normal",https://theplanttokyo.atlassian.net/browse/SHFT-1065?focusedCommentId=418585
Home,,JMA,"注意同时下mop/mds订单时，从home banner进入order detail是否会产生crash
Be aware that when placing both the mop and mds orders simultaneously, whether entering the order details from the home banner will cause a crash.",MMR-1012
Home,,JMA,"注意同时下mop/mds订单时，home banner展示是否正常
Please check whether the home banner is displayed normally when placing both the mop and mds orders simultaneously.",MMR-1010
Home,tab switching,KAK,"注意切换tab是否流畅
Pay attention to whether the tab switching is smooth",KAK-8290
Image alert,SEO,VHM,"注意不同语言的翻译细节
Pay attention to the translation in different languages","VHM-770
VHM-771"
Instore,Order detail,Lacoste,"注意检查payment method是否正常显示
Ensure that the payment method is displayed correctly.",LAX-4901 
Instore,,Lacoste,"「新功能」注意instore-app联合操作的部分 ，订单状态更新是否及时。
「New function」Pay attention to the part of the instore-app joint operation and check whether the order status is updated in a timely manner.",LAX-6875
Login,,Web-MDS,"检查长时间不操作，系统自动退出登陆后，确保个人信息UI是否为guest状态
Check if the personal information UI is in guest state after the system automatically logs out after a long period of inactivity.",MDS-3188
Login,,JMA,"检查同一个账号在app/web是否都能成功登录
Check whether the same account can successfully log in on the app/web",MDS-2915
Login,,JMA,"检查新账号反复登录登出是否成功
Check whether the new account logs in and out repeatedly successfully",JMA-2581
Login,MFA,JMA,"注意验证码是否达到发送限制，以及Android和iOS的行为是否一致。
Pay more attention to verification code reaching the sending limit,  and whether the behavior of Android and iOS is consistent.","JMA-2585
JMA-2361"
Login,Facebook/Twitter,JMA,"注意Prod上不同的登录方式是否都能成功登录
Pay more attention to different login methods on the Prod can be successfully logged in","JMA-2478
JMA-2487
JMA-2486
JMA-2725"
Login,,KAK,"注意打开webview/popup后登录功能是否还能正常使用。
Check whether the login function can still be used normally after opening webview/popup.",KAK-7575
Login,,KAK,"检查在web/app端退会后，在另一端登陆时错误提示是否显示正确
Check whether the error message displayed when logging in on the other end after logging out on the web/app end is correct.",KGM-1639
Login,,JMA,"注意检查中断login页面是否会闪退
Pay attention to checking whether the login interruption page will crash.",MDX-11694
Login MFA,,JMA,"检查更换邮箱使用错误邮箱并中断验证，流程是否能走通
Check if the process can proceed successfully after changing to an incorrect email address and interrupting verification.",CNV-1586
Loyalty,,Qor5,"注意退款之后过期的积分是否会退还
Pay attention to whether the expired points will be refunded after the refund",QOR5-1841
Loyalty,,Qor5,"注意检查使用的积分不应该是过期积分
Make sure to check that the used points are not expired points.",QOR5-1817
Map,Title,JMA,"注意店名/标题较长时，是否展示完全
When the store name/title is long, pay attention to whether it will be blocked",JMA-2401
Map,Area Search ,VHM,"检查所有语言下region map地址跳转是否正确
Check whether the region map address redirection correct in all languages",VHM-790
Map,Nearby Map,VHM,"检查地图是否展示正常
Check whether the map is displayed normally","
VHM-265"
Map,,VHM,"注意搜索结果默认展示是否正确
Pay attention to whether the default display of search results is correct",VHM-742
Map,favorite icon,JMA,"检查store finder页面店铺地图上favorite icon是否展示正常
Check whether the favorite icon on the store map on the store finder page is displayed normally",JMA-2164
Map,favorite icon,JMA,"检查店铺deeplink跳转后favorite icon是否展示正常
Check whether the favorite icon is displayed normally through the store deeplink",JMA-2204
Map,favorite icon,JMA,"关注最新购买过的店铺是否正常展示favorite icon
Check whether the favorite icon is displayed normally in the last used store",JMA-2214
Map,favorite icon,JMA,"收藏店铺列表页面只展示favorite icon
The favorite store list page only displays the favorite icon",JMA-2212
Map,favorite icon,JMA,"「新功能」检查Prod上GPS off 的时候，在Map收藏店铺icon显示是否正常
「New function」Pay more attention to Prod and much issues areas",JMA-2210
Map,favorite icon,JMA,"「新功能」检查UAT上好的功能在Prod上是否也是好的，以及注意bug集中的区域
「New function」Pay more attention to Prod and much issues areas",JMA-2196
Map,Search,JMA,"「新功能」注意地图的搜索范围
「New function」Pay more attention to the search area of the map",JMA-2229
Marketing,Popup,Qor5,"注意检查弹窗的文字显示是否符合使用逻辑
Pay attention to check whether the text display of the pop-up window conforms to the usage logic",QOR5-1214
Marketing,Schedule,Qor5,"注意检查截止日期当天是否能收到预定发送的email
Please check whether you can receive the scheduled email on the deadline.",QOR5-1165
Menu,Animation text ,JMA,"「新功能」注意更新版本后有没有缺少animation text
「New function」Note whether there is any missing animation text after updating the version",JMA-2420
Menu,Customize Products text ,JMA,"检查自定义产品类别title在menu的位置是否正确
Check whether the custom product category title is in the correct position in the menu","JMA-2469
JMA-2473"
MMR Reward details page,,JMA,"注意按钮置灰时的文案展示的优先级
Pay attention to the priority of the text display when the button is grayed out",MMR-840
MMR Coupon Tab,,JMA,"注意检查边界时间在不同语言的展示是否正常
Pay attention to checking whether the display of the boundary time is normal in different languages.",MMR-1483
MMT,MMT list,KAK,"注意对比app和web端MMT list排序是否一致
Pay attention to whether the sorting of MMT list on app and web is consistent",KAK-5394
MOP Coupon Tab,,JMA,"检查中断注册后，Coupon tab不应该展示登录后的样式
After a registration interruption, the Coupon tab should not display the logged-in style.",MDX-11693
My page,Address,KAK,"注意检查iOS和Android添加新地址的弹窗是否一致
Check whether the pop-up for adding a new address is the same on iOS and Android",KAK-2895
My page,,KAK,"确保退会账号无法在另一部已登录设备完成下单
Ensure that the cancelled account cannot complete orders on another logged-in device",KAK-2965
My page,Email,KAK,"检查能否多次成功修改邮箱
Check whether the email address can be successfully updated multiple times.",KAK-4647
My page,Address,KAK,"检查修改内容后，是否及时更新了页面
Check whether the page is updated promptly after the content is modified.
长时间的加载内容会使用户体验不佳
Long loading times can lead to a poor user experience.",KAK-4642
My page,Order history/再び購入,KAK,"检查不同页面点击商品图片能否正常跳转到PDP
Check whether clicking on product images on different pages can normally redirect to PDP",KAK-2759
Navigation bar,,KAK,"检查切换页面时导航栏的UI是否正常
Check whether the navigation bar UI displays correctly when switching pages.",KAK-2894
Cart/Order confirmation,,JMA,"注意检查多个coupon组合下单时各个页面产品名称是否会缺失
Check if product names are missing on each page when multiple coupon combinations are placed",JMA-2989
Order History,Drop-off delivery,JMA,"检查MDS order history的Drop-off delivery状态是否正确
Check whether the Drop-off delivery status of MDSorder history is correct",JMA-2211
Order History,Coupon,Lacoste,"注意历史订单页面的结算金额是否扣减优惠券（可通过Gmail价格对比）
Pay attention to whether the settlement amount on the historical order page is deducted from the coupon",LAX-4936
Page builder,Schedule publish,ThePlant website,"测试一些定时功能需要注意是否会有时区不一致的问题
When testing some timing functions, it is necessary to pay attention to whether there will be any inconsistency in time zones.",MAINT-347
PDP,,JMA,"注意下方banner是否会挡住内容
Pay attention to whether the bottom drawer affects user usage",JMA-2220
PDP,Size guide,Aigle,"打开Size guide时Web和mobile都要注意页面是否可以滑动
When opening Size guide, both Web and mobile should pay attention to whether the page can slide",LAX-5596
PDP,,KAK,"注意检查前后台商品详情信息是否一致，如果没有商品数据记得找开发提供
Please check whether the product detail information in the front and back ends is consistent. If there is no product data, remember to ask the development team for it",KAK-3933
PDP,,KAK,"注意商品Case内的产品数量大于商品总库存量时，不展示case选项
Note that when the number of products in a case is greater than the total inventory of the product, the case option will not be displayed.",KAK-3972
PDP,,KAK,"注意折扣信息展示的位置是否合理
Pay attention to whether the position of the discount information display is reasonable",KAK-2961
PDP,,JMA,"检查页面文字与文字之间是否对齐
Check whether the text on the page is aligned",JMA-3129
PDP,Rating star,KAK,"注意rating star应为固定显示，不可交互
The rating star should be displayed in a fixed manner and should not be interactive.",KAK-7502
PDP,,Lacoste,"检查网页横竖屏切换时，页面布局是否正常
Check whether the page layout is normal when switching between portrait and landscape modes on the web page.",LAX-7190
PDP,,KAK,"注意可以跳转的点击范围
Note the clickable range that allows for navigation.",KAK-8150
MMR Reward details page,,JMA,"注意多次兑换，重复进入detail page时，point显示是否正确
Please check whether the points are displayed correctly when repeatedly exchanging and entering the detail page multiple times.",MMR-1116
PDP,login,KAK,"检查匿名用户应先要求登录再进行跳转
Anonymous users should be requested to log in before redirection",KAK-8217
PDP,,JMA,"检查可选size的饮料，展示是否正常
Check the available sizes of the beverages and verify if they are functioning properly",CLR-539
PDP,Sauce,JMA,"检查特殊商品（15pc鸡块）添加酱料的提示展示是否正常
Check if the prompt for adding sauce to the special product (15pc chicken nuggets) is displayed correctly.",CF81D0TJ4
PDP,Video,Lacoste,"注意右键点击显示所有控件的功能是否会影响需求
Pay attention to whether the function of right-clicking to display all controls will affect the requirements",LAX-7512
PDP/Cart,,JMA,"注意从推荐产品(新产品)进入PDP时，检查产品信息是否完整
When entering the PDP from the recommended products (new products), make sure to check if the product information is complete.",JMA-3222
PLP/PDP,,Lacoste,"检查不同页面同一产品的价格显示是否一致
Check whether the price display of the same product on different pages is consistent.",LAX-7194
Pickup,,JMA,"注意检查同时有MDS/MOP订单时，切换查看pickup页面的UI是否正常
Please pay attention to checking whether the UI on the pickup page functions properly when there are both MDS/MOP orders.",MDX-11721
PLP,Product price,Aigle,"注意对比PDP/PLP的产品价格是否一致，比如是否含税
Check whether the product prices on PDP and PLP are consistent, such as whether tax is included.",LAX-5215
PLP,tag,Aigle,"注意检查popular tag显示是否完整
Ensure that the popular tag is displayed completely.",LAX-5617
PLP,Inherit filter,KAK,"检查清空筛选条件后，结果是否正确
Check whether the results are correct after clearing the filter conditions.",KAK-2747
PLP,Inherit filter,KAK,"排序功能注意和商品数据对比是否排序正确，如果没有商品数据记得找开发提供
For the sorting function, pay attention to comparing it with the product data to see if the sorting is correct. If there is no product data, remember to ask the developer for it",KAK-4428
MMR Reward list page,,JMA,"字体样式会有些细微的差别, 有特定要求时要注意字体是否正确。
There may be some subtle differences in font styles. When there are specific requirements, pay attention to whether the font is correct.",MMR-1149
PLP/Checkout,EDT,JMA,"注意不同支付方式的EDT不同，不同页面（PLP/Checkout）的默认支付方式（Cash/online）要一致
Note that the EDT of different payment methods is different, and the default payment method (Cash/online) should be the same for different pages (PLP/Checkout)","JMA-2594
JMA-2559
JMA-2560"
PLP/PDP,Price,JMA,"注意检查产品价格在PLP/PDP显示是否一致
Please check whether the product price is consistent in PLP/PDP",MDX-8253
PLP/PDP,popup,JMA,"注意一次性popup在切换页面（从PDP点击关联套餐跳转）时，是否会多次显示
Check whether a one-time popup appears multiple times when switching pages (jumping from PDP to a related bundle).",JMA-2824
PLP/PDP,,KAK,"考虑一些文字内容是否有显示的必要
Consider whether certain text content is necessary to display.
比如有整箱购买优惠的文字，实际价格并无优惠，此时可以隐藏该文字
For example, if a message indicates a bulk purchase discount but no actual discount is applied, it may be better to hide that text.",KAK-4748
PLP/PDP,,JMA,"注意检查千位分隔符
Be sure to check the thousands separator",JMA-3126
MMR Point history detail page,,JMA,"注意系统使用日本日历时APP内日期展示是否正常
Pay attention to whether the date display in the APP is normal when the system uses the Japanese calendar",MMR-924
Popup,,JMA,"注意检查错误提示与实际是否相符
Pay attention to checking whether the error messages match the actual situation.",MDX-11792
Product,,JMA,"注意切换Tab的时候，页面UI是否会出现异常
Pay attention to whether the page UI will be abnormal when switching tabs",JMA-3252
Register,verification code page,KAK,"检查输入验证码的页面，iOS17以上系统自带的自动输入验证码功能是否正常
Check the page where you enter the verification code. Is the automatic verification code entry function of iOS 17 or above working properly.",KAK-2776
Register,Location,KAK,"检查关闭手机系统定位服务后，点击定位按钮是否有反应
Check if there is any response when clicking the positioning button after turning off the mobile system phone positioning service.",KAK-2986
Register,,KAK,"[WEB]注意浏览器返回会不会对流程是否正确
[WEB] Note whether the browser's return value affects the correctness of the process.",KGM-1412
Register,,KAK,"注意检查在页面有其他链接可以跳转的情况下返回后流程是否能够正常进行
Please check whether the process can proceed normally after returning if there are other links on the page that can redirect.",KGM-1451
Register,,KAK,"检查切换选项后，是否影响流程
After checking the switching options, will it affect the process?",KGM-1364
Roommateinfo-form,,VHM,"检查可以上传的文件类型是否都可以上传成功
Check whether all uploadable file types can be uploaded successfully",VHM-1640
Store finder,Store list,JMA,"店铺搜索结果出来前，切换店铺列表检查是否会崩溃
Before the store search results come out, switch the store list to check if it will crash.",JMA-2378
Store finder,Selected tab,JMA,"检查Break order之后再取消订单，store finder会不会有异常
Check cancel the order after breaking order, store finder will not be abnormal",JMA-2692
Store finder,button,JMA,"注意在store finder界面，长名称店铺的order按钮是否正常
Pay attention to whether the order button of the store with a long name is normal in the store finder interface",JMA-3186
Sub links,,VHM,"注意对比PC/mobile应该展示的链接是否展示完全，icon是否展示是完整
Pay attention to whether the link that should be displayed on PC/mobile is displayed completely and whether the icon is displayed completely",VHM-832
Sub links,,VHM,"检查搜索后相应子链接是否展示，注意是否有城市名重复展示
Check whether the corresponding sub-links are displayed after the search, and pay attention to whether there are repeated city names",VHM-864
Coupon,,JMA,"在倒计时的页面将APP切换到后台，检查倒计时是否正确计时
Switch the app to the background on the countdown page and check if the countdown is working correctly.",CLR-397
Wrapping paper,,KAK,"注意检查不同分辨率手机排列布局是否展示正常
Please check whether the layout of mobile phones with different resolutions is displayed normally.",KAK-4883
Email,,KAK,"更加注意保持email中的订单详细信息与cart/shipping/payment/order history保持一致
Pay more attention to keeping the order details in the email consistent with cart/shipping/payment/order history",KAK-4892
PDP,sauce,JMA,"注意有sauce的产品在每个版本下是否都能正常展示sauce
Please ensure that products containing ""sauce"" display the sauce correctly across all versions.","MDX-12152
JMA-3427"
Coupon,KODO,JMA,"注意检查breakorder之后KODO是否在coupon list中移除
Please check if KODO has been removed from the coupon list after the breakorder.","CLR-730
CLR-746"
PDP,Tag,KAK,"注意检查前台展示的时间是否为JST
Please check if the time displayed on the front end is JST.",KGM-2251
Form,,VHM,"在测试表单的时候注意前后表单跳转是否符合流程
When testing the form, pay attention to whether the form transitions before and after conform to the process","VHM-1929
VHM-1935"
Form,,VHM,"注意下载的表格用不同文档阅读器打开是否兼容
Pay attention to whether the downloaded form is compatible when opened with different document readers",VHM-1936
MMR Coupon Tab,,JMA,"注意在旧版本兑换完reward之后再升级新版本是否能正常使用
Please note whether it can be used normally when upgrading to the new version after redeeming the reward in the old version",MMR-1628
PDP,,VHM,"注意reset之后功能与之前是否一致
Pay attention to whether the functions after reset are the same as before",VHM-1980
Cart,,JMA,"注意coupon和set 含有完全相同组合产品加入购物车时是否分开展示
Pay attention to whether the coupon and set contain exactly the same combination of products and are displayed separately when added to the cart",JMA-3431
Checkout,,JMA,"注意firebase修改配置后是否会影响前台
Note whether the configuration modification in Firebase will affect the front-end.",JMA-3439
Favorite,,KAK,"注意修改内容时，快速刷新页面后修改是否生效
Note that after quickly refreshing the page, the modifications will take effect.",KGM-1745
Coupon,,JMA,"注意线下使用的coupon在使用完后，是否从coupon bin移除
Please note whether the coupons used offline will be removed from the coupon bin after being used up.",CLR-618
Cart,,KAK,"注意清空Cart后，重新登陆，Cart的稍后购买是否完全清空
Please note that after clearing the Cart, if you log in again, will the subsequent purchases in the Cart be completely cleared?",KGM-1956
Register,Address,KAK,"注册账号选择地址时，回退上一步，展示的列表顺序是否一致
When registering an account and choosing the address, if you click the ""Back"" button, does the displayed list order remain the same?",KGM-1738